57,152,5,5,Against shake notice successful because.,2021-11-03 01:18:13 AM
519,8,1,0,Site accept pick floor.,2021-11-10 08:36:16 PM
716,8,5,4,Trade build east.,2021-11-03 04:53:48 PM
303,99,4,4,Bit feeling maintain force bring specific.,2021-11-03 06:52:48 PM
749,162,2,3,Hospital together article.,2021-11-05 02:57:40 PM
320,191,3,-5,Task hospital relationship them.,2021-11-10 01:00:37 AM
315,120,2,5,Shake stay too.,2021-11-02 04:14:22 PM
366,22,4,-2,Record today particular machine.,2021-11-04 05:35:43 PM
784,53,1,3,These treat citizen.,2021-11-07 05:21:41 PM
6,59,4,-4,Stop add test past.,2021-11-07 11:52:54 PM
706,85,5,1,Image simple reflect factor.,2021-11-08 01:55:16 AM
639,94,5,-2,Business safe another class born.,2021-11-08 05:36:37 AM
517,106,3,0,Production price challenge important return government.,2021-11-03 12:47:05 AM
853,198,1,-2,Up garden exist recently real.,2021-11-04 10:37:35 PM
956,121,5,3,Believe deal magazine give should.,2021-11-11 05:37:56 AM
830,187,5,-5,Probably executive husband may.,2021-11-05 07:14:10 AM
860,175,1,1,Focus whom author ability professor happen.,2021-11-06 09:52:32 AM
546,30,1,-5,Technology respond girl child though.,2021-11-04 01:44:44 AM
89,56,4,0,Simply way matter according truth accept.,2021-11-11 02:50:06 PM
494,52,2,-5,Whose month think develop recent news morning.,2021-11-05 07:48:57 AM
978,104,3,0,Onto travel story strategy.,2021-11-05 07:22:11 PM
575,129,4,-3,Yard little property tough.,2021-11-04 12:07:51 AM
34,142,1,-2,Unit staff country appear environmental.,2021-11-03 03:05:55 AM
289,118,2,-1,Improve officer difference.,2021-11-02 12:05:33 AM
549,43,2,-2,Record understand manage character.,2021-11-08 08:08:31 PM
654,131,2,1,Office air chance hope section stock.,2021-11-11 02:35:20 PM
878,101,5,3,Student bed certain series.,2021-11-11 02:11:46 AM
404,85,5,4,Improve article national.,2021-11-07 01:29:19 AM
901,64,4,3,Bag loss score social tax of.,2021-11-03 07:23:06 AM
490,121,1,-3,Red clear cup rather shake.,2021-11-10 01:21:56 AM
395,144,1,-4,Actually cost six think.,2021-11-04 09:44:35 AM
273,145,1,-5,Father month occur.,2021-11-08 08:37:21 PM
149,59,2,-4,Free often compare music raise.,2021-11-03 03:05:26 PM
190,105,4,-4,North eye place strategy speak before.,2021-11-10 11:27:33 AM
668,121,1,5,Investment letter cultural film whose key.,2021-11-11 05:26:35 AM
272,3,4,5,Something hit attention significant time.,2021-11-12 10:52:16 AM
76,95,2,4,Throw quickly rise.,2021-11-12 05:48:06 PM
539,113,4,-5,Apply friend process perhaps continue.,2021-11-11 08:29:22 PM
770,108,5,-3,Less particular late.,2021-11-03 06:18:27 PM
90,193,1,1,Cold yeah itself.,2021-11-12 04:31:38 PM
621,141,5,2,During follow deep individual stock rest.,2021-11-07 03:31:30 PM
161,161,4,0,Heavy rock music spend create.,2021-11-10 10:10:45 AM
994,143,2,-5,Special great drug reason.,2021-11-09 02:31:54 AM
413,56,4,5,Class war trade good paper benefit.,2021-11-12 07:00:56 AM
185,177,4,2,Large response population nature long.,2021-11-09 10:08:27 PM
221,117,3,5,Western her appear.,2021-11-04 02:33:56 PM
787,121,1,-3,Share hit impact walk.,2021-11-04 12:21:29 PM
3,171,3,-1,Government here point skill.,2021-11-03 01:25:51 PM
887,156,2,-4,Operation add thus service company we.,2021-11-10 06:37:41 AM
547,94,4,-5,Eight green today.,2021-11-08 07:57:12 PM
18,20,2,-1,Partner ability low.,2021-11-04 04:52:56 PM
832,149,1,3,No style heart people want.,2021-11-09 06:58:08 PM
914,1,3,-3,In voice much this key wish.,2021-11-09 03:16:37 PM
862,45,1,3,Allow minute bed care.,2021-11-06 10:13:48 PM
19,37,1,-1,Customer because threat.,2021-11-02 03:11:14 PM
738,28,5,0,Million believe former stand.,2021-11-10 10:32:46 PM
652,94,1,4,Theory all book process if.,2021-11-11 03:16:00 PM
992,147,3,5,Discover score instead.,2021-11-08 08:32:58 PM
933,15,5,1,Summer current bit there back himself concern.,2021-11-08 08:00:14 PM
153,19,5,-3,History rock tonight structure.,2021-11-10 05:28:29 PM
900,125,1,5,Bank phone town.,2021-11-11 08:58:47 AM
791,83,1,4,Court series fall force skin fund.,2021-11-10 01:23:02 PM
446,155,1,5,Feel last only practice.,2021-11-11 08:46:49 AM
598,152,2,3,Six remember explain best.,2021-11-09 11:04:09 PM
525,51,1,-2,Quality Mrs maybe form conference skin.,2021-11-08 12:52:19 PM
326,86,2,-1,Unit gun company.,2021-11-07 11:31:40 PM
80,76,4,-3,Bank system help us air behavior.,2021-11-08 04:09:05 AM
523,70,1,0,Dark main international.,2021-11-10 04:17:36 AM
73,170,5,5,Out laugh wrong.,2021-11-03 07:30:17 PM
117,97,1,2,Perhaps part drug view seven cold.,2021-11-08 04:34:10 PM
612,164,3,2,American child contain.,2021-11-11 04:14:12 PM
485,137,4,-3,Live decade small.,2021-11-05 07:48:51 AM
543,138,2,-5,That society bit.,2021-11-05 09:22:45 AM
563,142,4,4,Budget whom rest half small.,2021-11-10 11:14:09 PM
398,149,2,2,Goal keep involve.,2021-11-07 03:09:09 PM
834,106,2,0,Economic beat they.,2021-11-11 11:44:17 AM
874,17,5,5,Value investment section.,2021-11-02 02:02:13 AM
821,55,4,-3,Identify wish will would discover reality.,2021-11-06 08:55:28 AM
314,20,1,2,Rest debate listen help we morning.,2021-11-08 05:25:07 PM
501,89,5,1,Player issue feeling own final gas.,2021-11-11 07:47:17 AM
921,111,2,2,Enjoy prevent feel.,2021-11-06 11:14:54 AM
819,30,3,-2,Develop theory side.,2021-11-07 04:14:43 PM
290,148,4,3,Physical hot opportunity.,2021-11-08 03:53:46 PM
396,7,3,5,Between walk hit least imagine.,2021-11-11 12:15:05 AM
816,12,5,3,Improve sing glass voice her.,2021-11-11 07:30:29 AM
75,140,4,-3,Industry operation ground significant suddenly.,2021-11-04 01:06:42 PM
281,150,3,0,Personal since gas particularly.,2021-11-07 07:42:00 PM
192,65,2,-5,Feel significant back others treatment day.,2021-11-02 05:34:05 AM
500,106,4,-5,Everybody debate fire knowledge bill.,2021-11-07 02:51:39 PM
179,157,3,3,Upon class fall.,2021-11-05 12:14:01 AM
739,31,5,-5,Heavy poor expect clearly behavior personal.,2021-11-08 05:50:25 AM
647,95,4,4,Need see we energy use near.,2021-11-11 11:50:32 PM
186,70,1,-5,Operation prepare last.,2021-11-07 02:19:36 AM
744,10,2,-5,Remain good with they executive.,2021-11-06 11:26:44 PM
884,124,1,0,Environmental available decide movie tax.,2021-11-10 08:07:00 AM
477,144,4,-2,Five TV total.,2021-11-08 01:07:53 PM
857,105,4,4,Nothing item alone week thus issue.,2021-11-09 09:49:25 AM
898,158,1,-4,Article section when already while fire.,2021-11-09 12:33:51 AM
580,31,1,0,Save laugh address then make foot.,2021-11-11 05:58:43 PM
521,153,4,1,Minute charge factor recently left.,2021-11-06 07:45:40 PM
322,153,3,-3,Blood international conference.,2021-11-04 08:16:13 PM
530,134,2,5,Argue record ask employee activity.,2021-11-09 12:36:15 AM
758,114,4,3,Threat worker fight they country.,2021-11-07 02:50:02 AM
600,35,5,-2,Girl speech able hour cover.,2021-11-05 12:44:23 AM
226,167,2,-3,Own material move opportunity skin them.,2021-11-11 06:14:20 PM
641,53,4,-2,Chance fine whole activity tax country.,2021-11-10 08:56:00 AM
380,84,5,4,As knowledge participant.,2021-11-09 10:17:20 AM
786,32,4,5,Nice effort it view.,2021-11-07 01:28:32 AM
959,120,4,-2,Side way understand opportunity husband.,2021-11-10 06:56:20 PM
385,97,1,3,Less commercial stay.,2021-11-11 12:19:23 AM
750,174,2,4,Travel those determine effort.,2021-11-10 01:17:54 AM
790,113,5,3,Size decade will.,2021-11-05 03:05:55 PM
388,150,2,-4,Wish debate feeling.,2021-11-06 04:54:19 AM
205,120,4,2,Resource discussion young nothing painting.,2021-11-10 02:14:55 PM
393,166,1,-2,Direction might author.,2021-11-08 09:32:34 PM
638,89,1,2,Series involve shake.,2021-11-06 03:24:47 PM
937,39,2,5,Husband matter often.,2021-11-05 05:07:41 AM
555,106,2,0,Federal day red.,2021-11-08 02:16:19 PM
195,95,4,5,Clearly project imagine enough of.,2021-11-07 09:32:35 AM
972,187,2,-2,Would often region.,2021-11-07 06:50:57 PM
59,182,3,-1,Fall cold born woman himself.,2021-11-08 03:56:20 AM
58,167,5,-1,Onto rate father study Congress.,2021-11-02 04:17:23 AM
409,178,2,-5,Some age others.,2021-11-05 08:23:42 PM
82,185,4,1,Practice degree leader according.,2021-11-09 04:50:23 AM
16,153,3,0,Skill avoid reach culture.,2021-11-09 02:06:15 AM
336,129,1,0,School pattern nearly image about carry.,2021-11-07 09:36:17 AM
279,42,3,3,Two born phone.,2021-11-12 05:38:58 PM
998,79,5,-5,Get those direction fund one fight.,2021-11-09 04:54:55 PM
4,116,4,-1,Student entire someone civil account.,2021-11-10 11:21:38 AM
811,54,4,-3,Such interview of win key.,2021-11-10 01:38:32 AM
947,37,1,1,Space business scientist campaign common.,2021-11-02 12:48:14 AM
608,174,4,-4,Produce light wrong catch reveal want.,2021-11-10 08:33:30 AM
225,164,1,2,Every health service enjoy wall seven.,2021-11-09 10:43:43 AM
138,66,2,-4,Someone start chance five same.,2021-11-05 12:00:33 PM
906,94,4,3,Manage strong assume order parent.,2021-11-09 02:59:10 PM
124,124,1,-5,Power study yourself.,2021-11-04 10:00:32 PM
854,82,5,3,Million various what building weight seek.,2021-11-05 09:56:51 AM
815,182,3,4,Reality direction TV space.,2021-11-10 12:51:11 AM
605,43,4,-4,Different I defense cause boy rule.,2021-11-12 09:11:01 AM
673,135,4,-4,Practice care agreement next practice a sort.,2021-11-04 09:45:49 PM
253,63,4,2,Performance third most big skin body.,2021-11-04 08:00:20 PM
257,91,2,1,Add edge make.,2021-11-07 12:06:52 AM
606,169,1,2,Option over site hand.,2021-11-08 02:50:10 AM
875,120,4,5,During important benefit my.,2021-11-11 06:47:35 AM
812,78,5,2,Draw factor administration stand must.,2021-11-11 07:48:12 PM
318,99,4,-1,Meet light blood his.,2021-11-08 12:41:37 PM
980,149,5,5,Each sense difficult month.,2021-11-12 04:41:52 AM
39,187,2,2,Serious research their PM set.,2021-11-04 02:44:44 PM
131,133,2,-2,Interest though run hour.,2021-11-04 10:57:24 PM
335,0,4,2,Break move serve physical music.,2021-11-11 09:45:25 PM
504,65,5,2,Gun few always still us court.,2021-11-06 04:41:35 AM
459,2,4,-1,What official term.,2021-11-12 04:34:44 PM
951,177,5,2,Here trade say low.,2021-11-02 02:17:56 AM
357,142,5,-5,Guess every finally mouth eat what.,2021-11-08 04:58:09 PM
935,118,5,3,Glass even whatever before letter ready.,2021-11-12 05:18:23 AM
632,194,3,5,Necessary guess piece PM thus.,2021-11-12 02:56:18 PM
486,116,4,-1,White reality road.,2021-11-11 03:17:54 PM
333,161,2,-2,Country win thought.,2021-11-05 12:53:40 PM
364,187,2,0,Pressure network everybody image kitchen class.,2021-11-11 02:41:40 AM
865,66,5,-3,Film it although lay garden run.,2021-11-12 01:55:05 PM
604,84,5,-5,Claim trip expert last.,2021-11-04 11:36:54 AM
152,144,5,4,This evening national until.,2021-11-08 01:52:06 PM
352,196,1,-5,Data energy dog.,2021-11-08 01:29:22 AM
683,85,2,1,Change southern at statement above.,2021-11-05 06:24:25 AM
597,55,3,-3,Leader theory address.,2021-11-12 05:14:40 PM
896,83,2,-5,Past civil last recently strong.,2021-11-06 12:17:51 AM
659,3,2,2,Last meet record daughter relate.,2021-11-09 06:14:46 PM
817,6,3,-5,Yet term yard American challenge.,2021-11-02 01:25:35 PM
533,43,5,-2,Lay their court half road.,2021-11-07 11:40:59 PM
270,23,1,-5,Church the represent tree national.,2021-11-02 03:18:40 AM
371,97,2,5,Ask name sign fact full.,2021-11-03 08:44:39 PM
635,164,4,2,Peace civil million factor.,2021-11-03 05:49:02 PM
509,61,3,-5,Interesting between she.,2021-11-03 04:09:04 PM
384,162,4,5,Attorney pull claim cup likely.,2021-11-05 09:23:23 PM
797,164,3,-1,Develop action field price back good.,2021-11-10 05:58:47 AM
166,144,1,-3,Know allow everybody develop east without.,2021-11-07 08:36:56 AM
975,33,3,-5,Law your face recently operation necessary.,2021-11-10 07:03:39 AM
105,157,2,5,Old source respond green garden lead.,2021-11-03 11:21:17 PM
113,199,2,-4,Since song why decision sell beat.,2021-11-05 12:28:53 PM
966,84,5,2,Bad front represent material.,2021-11-07 05:14:18 AM
252,192,3,0,Hand still should its watch expert.,2021-11-10 01:53:08 AM
196,61,3,3,Miss these value deal.,2021-11-07 06:24:37 AM
599,82,4,0,Relationship anything ok player born.,2021-11-03 02:55:06 AM
321,192,5,-1,Chair recently total.,2021-11-09 12:14:30 PM
585,156,4,-5,Several heavy true.,2021-11-06 03:15:06 AM
415,54,1,2,Minute establish beyond population deal.,2021-11-04 02:35:09 AM
584,24,3,2,Imagine stage dog poor dream.,2021-11-02 10:49:41 AM
140,56,4,2,Race ever tree recent daughter development your.,2021-11-03 09:30:55 AM
411,19,3,-4,Something he skin cut share.,2021-11-10 05:11:02 AM
347,36,2,4,Decision push loss sign occur.,2021-11-04 10:25:58 AM
72,42,2,3,Civil floor marriage account.,2021-11-05 12:48:14 PM
458,54,3,-1,Training involve indicate garden treat.,2021-11-08 01:15:57 AM
613,161,2,-5,Approach can later civil line information.,2021-11-03 01:55:49 AM
958,160,5,1,Know cell reach hundred.,2021-11-06 07:06:55 AM
63,98,1,-3,Research daughter range.,2021-11-09 01:42:56 AM
213,167,2,2,Dream degree member rule.,2021-11-08 04:22:46 PM
461,63,3,1,Ball win old different leg audience.,2021-11-06 09:51:49 PM
532,29,1,1,Reach magazine that red Republican could.,2021-11-09 08:02:09 AM
284,59,2,-2,Early picture area show visit benefit.,2021-11-03 04:14:11 AM
793,52,5,-4,Author rise paper military.,2021-11-04 07:33:36 AM
