57,910,5,-5,Require able good together how head.,2021-11-03 01:18:13 AM
519,796,4,2,Admit concern single detail court.,2021-11-10 08:36:16 PM
716,246,5,-5,Floor mother test fact should pull.,2021-11-03 04:53:48 PM
303,53,2,2,Science beat through nice will.,2021-11-03 06:52:48 PM
749,771,4,-1,Approach with nice peace feeling maybe.,2021-11-05 02:57:40 PM
320,771,2,-5,Summer crime left use we.,2021-11-10 01:00:37 AM
315,619,5,2,Not you husband late open.,2021-11-02 04:14:22 PM
366,216,3,-4,Place sure hot stay must skill.,2021-11-04 05:35:43 PM
784,771,2,0,Official entire environment arm something should.,2021-11-07 05:21:41 PM
6,1,1,1,Tend brother resource president could word.,2021-11-07 11:52:54 PM
706,179,2,4,Record special party among throughout responsibility perform.,2021-11-08 01:55:16 AM
639,398,3,1,Hold trip bad when.,2021-11-08 05:36:37 AM
517,562,4,-1,Century finally number lose.,2021-11-03 12:47:05 AM
853,252,3,2,Environmental many two.,2021-11-04 10:37:35 PM
956,172,2,5,Our source degree smile general.,2021-11-11 05:37:56 AM
830,153,3,5,Approach call class herself worker.,2021-11-05 07:14:10 AM
860,433,3,-3,Feeling drive southern.,2021-11-06 09:52:32 AM
546,19,4,-2,Page put describe employee choose white.,2021-11-04 01:44:44 AM
89,28,4,4,Evening know cell although.,2021-11-11 02:50:06 PM
494,246,4,-5,Happen born board yourself Republican.,2021-11-05 07:48:57 AM
978,199,5,-5,Television clear director popular.,2021-11-05 07:22:11 PM
575,53,2,-3,Generation between response offer once thus.,2021-11-04 12:07:51 AM
34,2,2,-1,In place trip evening measure soon.,2021-11-03 03:05:55 AM
289,13,5,0,Record sing sense size.,2021-11-02 12:05:33 AM
549,743,2,0,And fine control political themselves though.,2021-11-08 08:08:31 PM
654,464,5,2,Box try among employee.,2021-11-11 02:35:20 PM
878,415,4,2,Attention explain factor those morning.,2021-11-11 02:11:46 AM
404,179,1,5,Reduce onto difference.,2021-11-07 01:29:19 AM
901,540,5,0,Collection lay child field assume.,2021-11-03 07:23:06 AM
490,172,5,-3,Line federal attention if baby generation.,2021-11-10 01:21:56 AM
395,874,2,1,Why reduce push until team area.,2021-11-04 09:44:35 AM
273,479,2,-5,Hope some owner throughout.,2021-11-08 08:37:21 PM
149,1,1,2,Day old place.,2021-11-03 03:05:26 PM
190,464,3,4,Think plan carry factor.,2021-11-10 11:27:33 AM
668,172,1,3,Field tonight article bring.,2021-11-11 05:26:35 AM
272,19,1,-3,Thank red idea outside.,2021-11-12 10:52:16 AM
76,816,4,4,Stay possible rule election I.,2021-11-12 05:48:06 PM
539,2,3,4,Class join instead detail allow.,2021-11-11 08:29:22 PM
770,232,2,-4,Several win age tough land night half.,2021-11-03 06:18:27 PM
90,190,1,2,There whatever will player.,2021-11-12 04:31:38 PM
621,490,2,-2,Place fish student win government plant.,2021-11-07 03:31:30 PM
161,402,3,1,Situation report agreement push.,2021-11-10 10:10:45 AM
994,981,4,2,Exist able current see into behind.,2021-11-09 02:31:54 AM
413,28,2,5,Bad between seat end hear single.,2021-11-12 07:00:56 AM
185,594,3,-3,Share group score writer.,2021-11-09 10:08:27 PM
221,497,5,3,Region simple dream argue.,2021-11-04 02:33:56 PM
787,172,2,-4,Call prepare lose son good pass.,2021-11-04 12:21:29 PM
3,221,3,2,Mean star move international PM.,2021-11-03 01:25:51 PM
887,569,3,-3,North my Republican.,2021-11-10 06:37:41 AM
547,398,2,-3,Town cause network.,2021-11-08 07:57:12 PM
18,248,4,0,Attention should through.,2021-11-04 04:52:56 PM
832,694,3,1,Someone night build.,2021-11-09 06:58:08 PM
914,402,2,-5,Later range black audience.,2021-11-09 03:16:37 PM
862,817,5,-5,Free process plant.,2021-11-06 10:13:48 PM
19,632,3,0,Resource seem necessary energy if now.,2021-11-02 03:11:14 PM
738,910,2,-4,Without dinner exist.,2021-11-10 10:32:46 PM
652,398,3,2,Purpose art east record carry.,2021-11-11 03:16:00 PM
992,348,4,4,Western present operation may suffer hour.,2021-11-08 08:32:58 PM
933,2,2,1,Age human pass.,2021-11-08 08:00:14 PM
153,479,4,5,Per campaign they also product case.,2021-11-10 05:28:29 PM
900,620,2,3,Thank leg than out shake activity.,2021-11-11 08:58:47 AM
791,841,3,3,Bad marriage leave political.,2021-11-10 01:23:02 PM
446,184,4,4,People clearly type.,2021-11-11 08:46:49 AM
598,910,4,-4,Sell while help decision hair.,2021-11-09 11:04:09 PM
525,699,2,2,Game decision summer like debate government.,2021-11-08 12:52:19 PM
326,415,4,1,Trial build line group back.,2021-11-07 11:31:40 PM
80,179,2,1,Specific room author.,2021-11-08 04:09:05 AM
523,498,5,4,Form success same.,2021-11-10 04:17:36 AM
73,693,3,3,Test common group policy keep environmental.,2021-11-03 07:30:17 PM
117,968,4,2,Ahead tough increase expect employee less.,2021-11-08 04:34:10 PM
612,213,2,3,Night leader expert ball will.,2021-11-11 04:14:12 PM
485,357,4,-4,Education according near minute nation answer.,2021-11-05 07:48:51 AM
543,357,4,-5,Institution ok born.,2021-11-05 09:22:45 AM
563,2,1,2,Line every present.,2021-11-10 11:14:09 PM
398,694,5,-4,Well nature machine.,2021-11-07 03:09:09 PM
834,562,1,0,Of drive anyone stock so.,2021-11-11 11:44:17 AM
874,743,1,-3,Piece age democratic activity.,2021-11-02 02:02:13 AM
821,740,1,4,Among TV prevent say finish during.,2021-11-06 08:55:28 AM
314,248,4,2,Phone ask treatment.,2021-11-08 05:25:07 PM
501,488,2,2,Water economy personal usually provide.,2021-11-11 07:47:17 AM
921,22,4,3,Talk often discuss you.,2021-11-06 11:14:54 AM
819,19,4,0,Note most actually move deep hand.,2021-11-07 04:14:43 PM
290,402,3,2,Billion service doctor act.,2021-11-08 03:53:46 PM
396,949,4,0,On home seat involve argue.,2021-11-11 12:15:05 AM
816,154,5,3,From blood child.,2021-11-11 07:30:29 AM
75,372,2,-2,Mouth bring hear.,2021-11-04 01:06:42 PM
281,179,3,4,Attorney relationship detail general idea.,2021-11-07 07:42:00 PM
192,620,1,5,Save dream nearly whole lay few.,2021-11-02 05:34:05 AM
500,562,2,5,Poor heavy week clear medical.,2021-11-07 02:51:39 PM
179,619,5,4,Into option agency.,2021-11-05 12:14:01 AM
739,357,4,-5,Him generation ask.,2021-11-08 05:50:25 AM
647,816,1,-1,Nor little life.,2021-11-11 11:50:32 PM
186,498,4,-2,Store idea art western guy.,2021-11-07 02:19:36 AM
744,712,3,-4,One enough cause success.,2021-11-06 11:26:44 PM
884,90,1,4,Song against while that.,2021-11-10 08:07:00 AM
477,874,5,-4,All carry statement price.,2021-11-08 01:07:53 PM
857,464,3,-3,See feel probably short.,2021-11-09 09:49:25 AM
898,619,4,-3,Return time animal growth.,2021-11-09 12:33:51 AM
580,357,3,4,Memory free certainly series ten.,2021-11-11 05:58:43 PM
521,179,4,-2,Chance option can type space feeling.,2021-11-06 07:45:40 PM
322,179,3,-3,Already always over name.,2021-11-04 08:16:13 PM
530,479,1,4,Point artist watch somebody behavior.,2021-11-09 12:36:15 AM
758,632,2,1,Financial opportunity push before compare dog.,2021-11-07 02:50:02 AM
600,740,2,-4,Above economic building green.,2021-11-05 12:44:23 AM
226,910,3,2,Middle benefit look them know strategy.,2021-11-11 06:14:20 PM
641,771,5,1,Place administration bring according.,2021-11-10 08:56:00 AM
380,575,4,5,Stop those if prove.,2021-11-09 10:17:20 AM
786,153,5,-2,Ball arrive during.,2021-11-07 01:28:32 AM
959,619,3,4,Five dog meet wrong store party.,2021-11-10 06:56:20 PM
385,968,3,-4,Within wife everybody.,2021-11-11 12:19:23 AM
750,854,1,-2,Though hot writer.,2021-11-10 01:17:54 AM
790,2,4,4,Stop treatment especially music professor.,2021-11-05 03:05:55 PM
388,179,4,1,Report yeah red take issue.,2021-11-06 04:54:19 AM
205,619,2,-4,Make pretty both everything role.,2021-11-10 02:14:55 PM
393,815,4,-4,Wide contain feel resource understand language.,2021-11-08 09:32:34 PM
638,488,1,0,Summer store wear notice college.,2021-11-06 03:24:47 PM
937,349,3,0,Team public parent house mention.,2021-11-05 05:07:41 AM
555,562,4,1,Throughout why there.,2021-11-08 02:16:19 PM
195,816,2,5,Develop morning heavy.,2021-11-07 09:32:35 AM
972,153,3,2,Provide well him under development.,2021-11-07 06:50:57 PM
59,28,3,3,Serve boy environment.,2021-11-08 03:56:20 AM
58,910,4,3,Newspaper stage information hotel behavior walk.,2021-11-02 04:17:23 AM
409,16,3,1,This course on financial policy explain.,2021-11-05 08:23:42 PM
82,816,4,5,Side administration animal bit field.,2021-11-09 04:50:23 AM
16,179,3,0,Thus eight despite.,2021-11-09 02:06:15 AM
336,53,3,2,Morning kitchen plan bar.,2021-11-07 09:36:17 AM
279,164,4,2,Wife black be war.,2021-11-12 05:38:58 PM
998,620,5,2,Firm generation own war child.,2021-11-09 04:54:55 PM
4,1,1,3,Training develop through win wife.,2021-11-10 11:21:38 AM
811,1,3,1,Might return book itself across.,2021-11-10 01:38:32 AM
947,632,2,4,Performance offer young behavior.,2021-11-02 12:48:14 AM
608,854,4,4,Join camera establish human expert.,2021-11-10 08:33:30 AM
225,213,1,4,Individual church talk speech.,2021-11-09 10:43:43 AM
138,216,3,-5,Allow shake yet.,2021-11-05 12:00:33 PM
906,398,5,0,Quality than rate court senior.,2021-11-09 02:59:10 PM
124,90,3,-4,Someone order hard own prevent.,2021-11-04 10:00:32 PM
854,13,4,4,Matter face center.,2021-11-05 09:56:51 AM
815,28,3,-1,Bed strategy debate white memory.,2021-11-10 12:51:11 AM
605,743,5,-3,Common huge daughter.,2021-11-12 09:11:01 AM
673,183,2,-3,Quickly foreign mother tax half.,2021-11-04 09:45:49 PM
253,82,3,-4,Notice thank individual represent.,2021-11-04 08:00:20 PM
257,527,5,-5,Its many go until.,2021-11-07 12:06:52 AM
606,13,2,4,Action material seem find wife.,2021-11-08 02:50:10 AM
875,619,1,1,New if want write letter.,2021-11-11 06:47:35 AM
812,817,2,4,Pattern service either image.,2021-11-11 07:48:12 PM
318,53,5,2,First want same write four understand.,2021-11-08 12:41:37 PM
980,694,5,-5,Trouble continue sea.,2021-11-12 04:41:52 AM
39,153,4,-2,Mother ball free.,2021-11-04 02:44:44 PM
131,632,3,4,Reality each believe mouth few.,2021-11-04 10:57:24 PM
335,349,2,3,For war hit student event.,2021-11-11 09:45:25 PM
504,620,5,0,Use my minute lay stand few.,2021-11-06 04:41:35 AM
459,816,1,5,Clearly event enough huge quality.,2021-11-12 04:34:44 PM
951,594,5,-5,Deep down step center carry.,2021-11-02 02:17:56 AM
357,2,1,4,Court scene tree let seek maybe.,2021-11-08 04:58:09 PM
935,13,3,1,Society current yeah truth.,2021-11-12 05:18:23 AM
632,490,3,4,Audience true kid.,2021-11-12 02:56:18 PM
486,1,2,-3,Rich put particularly.,2021-11-11 03:17:54 PM
486,1,2,-3,Rich put particularly.,2021-11-11 03:17:54 PM
333,402,1,4,Lead necessary with grow.,2021-11-05 12:53:40 PM
364,153,3,-3,Light practice measure.,2021-11-11 02:41:40 AM
865,216,1,3,Mean human during spend.,2021-11-12 01:55:05 PM
604,575,5,0,Recent support toward without.,2021-11-04 11:36:54 AM
152,874,1,1,Main letter blood.,2021-11-08 01:52:06 PM
352,620,4,4,Walk cut like turn.,2021-11-08 01:29:22 AM
683,179,3,-5,Order middle point next dinner.,2021-11-05 06:24:25 AM
597,740,2,2,Pay day democratic.,2021-11-12 05:14:40 PM
896,841,4,4,Care knowledge letter recognize summer.,2021-11-06 12:17:51 AM
659,19,4,2,Much rest yes add cell church.,2021-11-09 06:14:46 PM
817,632,5,-3,Sense lead hotel human control hot.,2021-11-02 01:25:35 PM
533,743,3,1,Between teacher training.,2021-11-07 11:40:59 PM
270,971,3,3,Stand really seek poor other.,2021-11-02 03:18:40 AM
371,968,5,2,Indeed measure certainly them maybe.,2021-11-03 08:44:39 PM
635,213,4,-2,School western section.,2021-11-03 05:49:02 PM
509,26,1,1,Put process watch first.,2021-11-03 04:09:04 PM
384,771,2,-5,Hotel material trade third.,2021-11-05 09:23:23 PM
797,213,2,5,Old at form meet wife.,2021-11-10 05:58:47 AM
166,874,2,4,Stage space late.,2021-11-07 08:36:56 AM
975,372,4,0,Open eat half.,2021-11-10 07:03:39 AM
105,619,5,1,What serve whole school important.,2021-11-03 11:21:17 PM
113,172,1,4,Guess though huge alone.,2021-11-05 12:28:53 PM
966,575,1,-3,Wonder here and its.,2021-11-07 05:14:18 AM
252,592,3,-2,Any discover hope level.,2021-11-10 01:53:08 AM
196,26,1,4,Training relationship as.,2021-11-07 06:24:37 AM
599,13,2,-4,Risk cultural which responsibility again lot.,2021-11-03 02:55:06 AM
321,592,5,0,Five difference start western age Democrat teacher.,2021-11-09 12:14:30 PM
585,569,2,-1,Play resource way argue chair.,2021-11-06 03:15:06 AM
415,1,1,1,Same remember perhaps wish.,2021-11-04 02:35:09 AM
584,816,5,1,Change stage air.,2021-11-02 10:49:41 AM
140,28,1,0,Market baby ready since.,2021-11-03 09:30:55 AM
411,479,2,2,Much really large.,2021-11-10 05:11:02 AM
347,981,2,-3,Eye able easy key.,2021-11-04 10:25:58 AM
72,164,4,2,Toward or experience now.,2021-11-05 12:48:14 PM
458,1,3,-5,Health can policy size school.,2021-11-08 01:15:57 AM
613,402,2,-3,Summer everybody gun film.,2021-11-03 01:55:49 AM
958,815,5,1,Tree behavior since.,2021-11-06 07:06:55 AM
63,655,2,3,Grow think behind performance.,2021-11-09 01:42:56 AM
213,910,4,-4,Bank raise why make.,2021-11-08 04:22:46 PM
461,82,4,-4,General fact can marriage easy.,2021-11-06 09:51:49 PM
532,90,2,-4,Yeah form continue.,2021-11-09 08:02:09 AM
284,1,4,5,Plant dinner star PM.,2021-11-03 04:14:11 AM
793,246,3,-1,Happen just story likely.,2021-11-04 07:33:36 AM
